{
  "id": "sup_20260430_00121",
  "worker": {
    "id": "w_100542",
    "descriptor": "Weekly USD Pay Group"
  },
  "earningCode": "REGULAR",
  "type": "Bonus",
  "amount": 2500.0,
  "currency": "USD",
  "effectiveDate": "2026-04-30",
  "status": "Pending",
  "reason": "Q1 2026 performance bonus",
  "createdOn": "2026-04-30T16:45:00Z"
}
